{
  "$schema": "./apple-canary-deployment-state.schema.json",
  "schemaVersion": 1,
  "mode": "apple_canary_authorized_subtree_state_machine",
  "phase": "media_staged",
  "orderedPhases": ["closed", "media_staged", "active", "contained"],
  "allowedForwardTransitions": [
    "closed_to_media_staged",
    "media_staged_to_active",
    "active_to_contained"
  ],
  "feedSnapshotByPhase": {
    "closed": "historical",
    "media_staged": "historical",
    "active": "active",
    "contained": "contained"
  },
  "sealedFeedSnapshots": {
    "storageEncoding": "utf8_with_one_terminal_lf_removed_before_publish",
    "historical": {
      "path": "publishing/apple-republish-canary-snapshots/historical.xml",
      "storedSha256": "f18b0e09a2212389c901675329d5bd3d2f23db758b8d38c2e7854ad73c7b9216",
      "publishedSha256": "8ca7b219593efee9920fbe2267f7e11796e72a3b8865f46865b06f36257b103b"
    },
    "active": {
      "path": "publishing/apple-republish-canary-snapshots/active.xml",
      "storedSha256": "6e5d41e366ee3d13ec3e25a272989bed97d1e249843b451ed98ac3fd44528fa6",
      "publishedSha256": "caa85ee126729629036aba67cc37ef132fad79055f56c77ba6b999e830d2a96a"
    },
    "contained": {
      "path": "publishing/apple-republish-canary-snapshots/contained.xml",
      "storedSha256": "6437fdc6827c321135ca89fae0eb8b6bdf41d4e9d563988e41ba0270b9bb645e",
      "publishedSha256": "31b7b21a60d567f43c0fa402add70df7a945f7446ae76cc222c51b36502bd99c"
    }
  },
  "sealedMediaAsset": {
    "path": "publishing/apple-republish-canary-assets/brain-fog-part-1-9f9402d98ec297cd.mpga",
    "length": 16339867,
    "sha256": "9f9402d98ec297cd350e6c6859e1d79459ca5e35ba44bbb4797eb4ef09a1c65b"
  },
  "mediaStagedPublicEvidence": null,
  "transitionAuthorization": {
    "approvedTargetPhase": "media_staged",
    "recordedAt": "2026-08-27T04:36:14Z",
    "authorizedBy": "Otto",
    "approvalBasis": "Owner explicitly approved both canary phases with rollback on failure in Codex on 2026-08-26; this transition stages only the exact hash-bound Episode 1 media while preserving the byte-identical historical Apple feed."
  }
}
